{
  "context": [
    "game/buildings/CLAUDE.md",
    ".claude/commands/add-building.md"
  ],
  "description": "Spawns an agent that adds a new building type: leaf class + research row + registry + balancing subtree + slots (10B-10E pattern).",
  "fields": [
    {
      "description": "Display name; drives the leaf class name, BUILDING_TYPE, balancing subtree key and branch slug.",
      "key": "name",
      "label": "Building name",
      "placeholder": "Sun Scorcher",
      "required": true,
      "type": "string"
    },
    {
      "default": "defence",
      "description": "Which parent/module the leaf hangs off (defence.py / economy.py / boost.py-style / structure.py). The parent computes derived stats.",
      "key": "parent_family",
      "label": "Parent family",
      "options": [
        "defence",
        "economy",
        "boost",
        "structure"
      ],
      "type": "enum"
    },
    {
      "default": false,
      "description": "Advertises via the Attacker component + the 'combat' tag (never an IS_COMBAT flag) so the combat sweep stays type-agnostic.",
      "key": "is_combat",
      "label": "Combat building",
      "type": "boolean"
    },
    {
      "default": true,
      "description": "ResearchSpec.starts_unlocked. False = earned via a level-up unlock reward.",
      "key": "starts_unlocked",
      "label": "Starts unlocked",
      "type": "boolean"
    },
    {
      "default": 1,
      "description": "ResearchSpec.starts_with_tier. 0 means even tier 1 must be researched.",
      "key": "starts_with_tier",
      "label": "Starts with tier",
      "maximum": 3,
      "minimum": 0,
      "type": "integer"
    },
    {
      "default": "none",
      "description": "ResearchSpec.gate_kind. The spec stores WHERE in buildings.json the gate value lives, never the value.",
      "key": "gate_kind",
      "label": "Unlock gate",
      "options": [
        "none",
        "min_village_level",
        "min_round"
      ],
      "type": "enum"
    },
    {
      "default": 3,
      "description": "How many tier sprite prefixes (TIER_SPRITES) and slots.json tier groups to add.",
      "key": "tier_count",
      "label": "Tier count",
      "maximum": 3,
      "minimum": 1,
      "type": "integer"
    }
  ],
  "git_default": "branch",
  "id": "add-building",
  "schema_version": 1,
  "selector_context": "buildings",
  "skill": "add-building",
  "slug_field": "name",
  "title": "Add New Building"
}
